
*** Running vivado
    with args -log top.vdi -applog -m64 -messageDb vivado.pb -mode batch -source top.tcl -notrace


****** Vivado v2016.2 (64-bit)
  **** SW Build 1577090 on Thu Jun  2 16:32:40 MDT 2016
  **** IP Build 1577682 on Fri Jun  3 12:00:54 MDT 2016
    ** Copyright 1986-2016 Xilinx, Inc. All Rights Reserved.

source top.tcl -notrace
Design is defaulting to srcset: sources_1
Design is defaulting to constrset: constrs_1
INFO: [Netlist 29-17] Analyzing 26 Unisim elements for replacement
INFO: [Netlist 29-28] Unisim Transformation completed in 0 CPU seconds
INFO: [Project 1-479] Netlist was created with Vivado 2016.2
INFO: [Device 21-403] Loading part xc7a35tcpg236-1
INFO: [Project 1-570] Preparing netlist for logic optimization
Parsing XDC File [C:/Users/Thomas/Desktop/logicDesignLab/final project/display_test/display_test.srcs/constrs_1/new/gg.xdc]
Finished Parsing XDC File [C:/Users/Thomas/Desktop/logicDesignLab/final project/display_test/display_test.srcs/constrs_1/new/gg.xdc]
INFO: [Opt 31-138] Pushed 0 inverter(s) to 0 load pin(s).
INFO: [Project 1-111] Unisim Transformation Summary:
No Unisim elements were transformed.

INFO: [Vivado_Tcl 4-424] Cannot write hardware definition file as there are no IPI block design hardware handoff files present
Command: opt_design
Attempting to get a license for feature 'Implementation' and/or device 'xc7a35t'
INFO: [Common 17-349] Got license for feature 'Implementation' and/or device 'xc7a35t'
Running DRC as a precondition to command opt_design

Starting DRC Task
INFO: [DRC 23-27] Running DRC with 2 threads
INFO: [Project 1-461] DRC finished with 0 Errors
INFO: [Project 1-462] Please refer to the DRC report (report_drc) for more information.

Time (s): cpu = 00:00:00 ; elapsed = 00:00:00.090 . Memory (MB): peak = 453.883 ; gain = 4.316
INFO: [Timing 38-35] Done setting XDC timing constraints.

Starting Logic Optimization Task
Implement Debug Cores | Checksum: 1aef6fab0

Phase 1 Retarget
INFO: [Opt 31-138] Pushed 2 inverter(s) to 12 load pin(s).
INFO: [Opt 31-194] Inserted BUFG clk_25MHz_BUFG_inst to drive 86 load(s) on clock net clk_25MHz
INFO: [Opt 31-193] Inserted 1 BUFG(s) on clock nets
INFO: [Opt 31-49] Retargeted 0 cell(s).
Phase 1 Retarget | Checksum: 2356416b6

Time (s): cpu = 00:00:00 ; elapsed = 00:00:00.204 . Memory (MB): peak = 913.688 ; gain = 0.000

Phase 2 Constant Propagation
INFO: [Opt 31-138] Pushed 0 inverter(s) to 0 load pin(s).
INFO: [Opt 31-10] Eliminated 6 cells.
Phase 2 Constant Propagation | Checksum: 144b85e6e

Time (s): cpu = 00:00:00 ; elapsed = 00:00:00.238 . Memory (MB): peak = 913.688 ; gain = 0.000

Phase 3 Sweep
INFO: [Opt 31-12] Eliminated 340 unconnected nets.
INFO: [Opt 31-11] Eliminated 198 unconnected cells.
Phase 3 Sweep | Checksum: b9106102

Time (s): cpu = 00:00:00 ; elapsed = 00:00:00.441 . Memory (MB): peak = 913.688 ; gain = 0.000

Starting Connectivity Check Task

Time (s): cpu = 00:00:00 ; elapsed = 00:00:00 . Memory (MB): peak = 913.688 ; gain = 0.000
Ending Logic Optimization Task | Checksum: b9106102

Time (s): cpu = 00:00:00 ; elapsed = 00:00:00.441 . Memory (MB): peak = 913.688 ; gain = 0.000

Starting Power Optimization Task
INFO: [Pwropt 34-132] Skipping clock gating for clocks with a period < 2.00 ns.
INFO: [Timing 38-35] Done setting XDC timing constraints.
Running Vector-less Activity Propagation...

Finished Running Vector-less Activity Propagation
INFO: [Pwropt 34-9] Applying IDT optimizations ...
INFO: [Pwropt 34-10] Applying ODC optimizations ...


Starting PowerOpt Patch Enables Task
INFO: [Pwropt 34-162] WRITE_MODE attribute of 0 BRAM(s) out of a total of 16 has been updated to save power. Run report_power_opt to get a complete listing of the BRAMs updated.
INFO: [Pwropt 34-201] Structural ODC has moved 0 WE to EN ports
Number of BRAM Ports augmented: 0 newly gated: 5 Total Ports: 32
Ending PowerOpt Patch Enables Task | Checksum: 196239e28

Time (s): cpu = 00:00:00 ; elapsed = 00:00:00.010 . Memory (MB): peak = 1075.164 ; gain = 0.000
Ending Power Optimization Task | Checksum: 196239e28

Time (s): cpu = 00:00:03 ; elapsed = 00:00:02 . Memory (MB): peak = 1075.164 ; gain = 161.477
INFO: [Common 17-83] Releasing license: Implementation
28 Infos, 0 Warnings, 0 Critical Warnings and 0 Errors encountered.
opt_design completed successfully
opt_design: Time (s): cpu = 00:00:13 ; elapsed = 00:00:12 . Memory (MB): peak = 1075.164 ; gain = 625.598
Writing placer database...
Writing XDEF routing.
Writing XDEF routing logical nets.
Writing XDEF routing special nets.
Write XDEF Complete: Time (s): cpu = 00:00:00 ; elapsed = 00:00:00.040 . Memory (MB): peak = 1075.164 ; gain = 0.000
INFO: [DRC 23-27] Running DRC with 2 threads
INFO: [Coretcl 2-168] The results of DRC are in file C:/Users/Thomas/Desktop/logicDesignLab/final project/display_test/display_test.runs/impl_1/top_drc_opted.rpt.
INFO: [Chipscope 16-241] No debug cores found in the current design.
Before running the implement_debug_core command, either use the Set Up Debug wizard (GUI mode)
or use the create_debug_core and connect_debug_core Tcl commands to insert debug cores into the design.
Command: place_design
Attempting to get a license for feature 'Implementation' and/or device 'xc7a35t'
INFO: [Common 17-349] Got license for feature 'Implementation' and/or device 'xc7a35t'
INFO: [DRC 23-27] Running DRC with 2 threads
INFO: [Vivado_Tcl 4-198] DRC finished with 0 Errors
INFO: [Vivado_Tcl 4-199] Please refer to the DRC report (report_drc) for more information.
Running DRC as a precondition to command place_design
INFO: [DRC 23-27] Running DRC with 2 threads
INFO: [Vivado_Tcl 4-198] DRC finished with 0 Errors
INFO: [Vivado_Tcl 4-199] Please refer to the DRC report (report_drc) for more information.

Starting Placer Task
INFO: [Place 30-611] Multithreading enabled for place_design using a maximum of 2 CPUs

Phase 1 Placer Initialization
Netlist sorting complete. Time (s): cpu = 00:00:00 ; elapsed = 00:00:00.010 . Memory (MB): peak = 1075.164 ; gain = 0.000
INFO: [Timing 38-35] Done setting XDC timing constraints.
INFO: [Opt 31-138] Pushed 0 inverter(s) to 0 load pin(s).
Netlist sorting complete. Time (s): cpu = 00:00:00 ; elapsed = 00:00:00.010 . Memory (MB): peak = 1075.164 ; gain = 0.000

Phase 1.1 IO Placement/ Clock Placement/ Build Placer Device

Phase 1.1.1 ParallelPlaceIOClockAndInitTop

Phase 1.1.1.1 Pre-Place Cells
Phase 1.1.1.1 Pre-Place Cells | Checksum: 698e3709

Time (s): cpu = 00:00:00 ; elapsed = 00:00:00.120 . Memory (MB): peak = 1075.164 ; gain = 0.000

Phase 1.1.1.2 Constructing HAPIClkRuleMgr
Phase 1.1.1.2 Constructing HAPIClkRuleMgr | Checksum: 698e3709

Time (s): cpu = 00:00:00 ; elapsed = 00:00:00.130 . Memory (MB): peak = 1075.164 ; gain = 0.000
INFO: [Timing 38-35] Done setting XDC timing constraints.

Phase 1.1.1.3 IO and Clk Clean Up

Phase 1.1.1.3.1 Constructing HAPIClkRuleMgr
Phase 1.1.1.3.1 Constructing HAPIClkRuleMgr | Checksum: 698e3709

Time (s): cpu = 00:00:01 ; elapsed = 00:00:00.771 . Memory (MB): peak = 1075.164 ; gain = 0.000
Phase 1.1.1.3 IO and Clk Clean Up | Checksum: 698e3709

Time (s): cpu = 00:00:01 ; elapsed = 00:00:00.781 . Memory (MB): peak = 1075.164 ; gain = 0.000

Phase 1.1.1.4 Implementation Feasibility check On IDelay
Phase 1.1.1.4 Implementation Feasibility check On IDelay | Checksum: 698e3709

Time (s): cpu = 00:00:01 ; elapsed = 00:00:00.781 . Memory (MB): peak = 1075.164 ; gain = 0.000

Phase 1.1.1.5 Commit IO Placement
Phase 1.1.1.5 Commit IO Placement | Checksum: 2cb06b54

Time (s): cpu = 00:00:01 ; elapsed = 00:00:00.781 . Memory (MB): peak = 1075.164 ; gain = 0.000
Phase 1.1.1 ParallelPlaceIOClockAndInitTop | Checksum: 2cb06b54

Time (s): cpu = 00:00:01 ; elapsed = 00:00:00.781 . Memory (MB): peak = 1075.164 ; gain = 0.000
Phase 1.1 IO Placement/ Clock Placement/ Build Placer Device | Checksum: 6293c11d

Time (s): cpu = 00:00:01 ; elapsed = 00:00:00.781 . Memory (MB): peak = 1075.164 ; gain = 0.000

Phase 1.2 Build Placer Netlist Model

Phase 1.2.1 Place Init Design

Phase 1.2.1.1 Make Others
Phase 1.2.1.1 Make Others | Checksum: b0c4f1d9

Time (s): cpu = 00:00:01 ; elapsed = 00:00:00.811 . Memory (MB): peak = 1075.164 ; gain = 0.000

Phase 1.2.1.2 Init Lut Pin Assignment
Phase 1.2.1.2 Init Lut Pin Assignment | Checksum: b0c4f1d9

Time (s): cpu = 00:00:01 ; elapsed = 00:00:00.821 . Memory (MB): peak = 1075.164 ; gain = 0.000
Phase 1.2.1 Place Init Design | Checksum: 8678e0eb

Time (s): cpu = 00:00:01 ; elapsed = 00:00:00.981 . Memory (MB): peak = 1075.164 ; gain = 0.000
Phase 1.2 Build Placer Netlist Model | Checksum: 8678e0eb

Time (s): cpu = 00:00:01 ; elapsed = 00:00:00.981 . Memory (MB): peak = 1075.164 ; gain = 0.000

Phase 1.3 Constrain Clocks/Macros
Phase 1.3 Constrain Clocks/Macros | Checksum: 8678e0eb

Time (s): cpu = 00:00:01 ; elapsed = 00:00:00.981 . Memory (MB): peak = 1075.164 ; gain = 0.000
Phase 1 Placer Initialization | Checksum: 8678e0eb

Time (s): cpu = 00:00:01 ; elapsed = 00:00:00.981 . Memory (MB): peak = 1075.164 ; gain = 0.000

Phase 2 Global Placement
Phase 2 Global Placement | Checksum: 18b4b1af5

Time (s): cpu = 00:00:02 ; elapsed = 00:00:01 . Memory (MB): peak = 1075.164 ; gain = 0.000

Phase 3 Detail Placement

Phase 3.1 Commit Multi Column Macros
Phase 3.1 Commit Multi Column Macros | Checksum: 18b4b1af5

Time (s): cpu = 00:00:02 ; elapsed = 00:00:01 . Memory (MB): peak = 1075.164 ; gain = 0.000

Phase 3.2 Commit Most Macros & LUTRAMs
Phase 3.2 Commit Most Macros & LUTRAMs | Checksum: 12a35a6a1

Time (s): cpu = 00:00:02 ; elapsed = 00:00:01 . Memory (MB): peak = 1075.164 ; gain = 0.000

Phase 3.3 Area Swap Optimization
Phase 3.3 Area Swap Optimization | Checksum: 14e33ae2f

Time (s): cpu = 00:00:02 ; elapsed = 00:00:01 . Memory (MB): peak = 1075.164 ; gain = 0.000

Phase 3.4 updateClock Trees: DP
Phase 3.4 updateClock Trees: DP | Checksum: 14e33ae2f

Time (s): cpu = 00:00:02 ; elapsed = 00:00:01 . Memory (MB): peak = 1075.164 ; gain = 0.000

Phase 3.5 Timing Path Optimizer
Phase 3.5 Timing Path Optimizer | Checksum: 1b1089d82

Time (s): cpu = 00:00:02 ; elapsed = 00:00:01 . Memory (MB): peak = 1075.164 ; gain = 0.000

Phase 3.6 Fast Optimization
Phase 3.6 Fast Optimization | Checksum: 1b1089d82

Time (s): cpu = 00:00:02 ; elapsed = 00:00:01 . Memory (MB): peak = 1075.164 ; gain = 0.000

Phase 3.7 Small Shape Detail Placement
Phase 3.7 Small Shape Detail Placement | Checksum: 11230f25f

Time (s): cpu = 00:00:02 ; elapsed = 00:00:02 . Memory (MB): peak = 1075.164 ; gain = 0.000

Phase 3.8 Re-assign LUT pins
Phase 3.8 Re-assign LUT pins | Checksum: 134190fbb

Time (s): cpu = 00:00:02 ; elapsed = 00:00:02 . Memory (MB): peak = 1075.164 ; gain = 0.000

Phase 3.9 Pipeline Register Optimization
Phase 3.9 Pipeline Register Optimization | Checksum: 134190fbb

Time (s): cpu = 00:00:02 ; elapsed = 00:00:02 . Memory (MB): peak = 1075.164 ; gain = 0.000

Phase 3.10 Fast Optimization
Phase 3.10 Fast Optimization | Checksum: 134190fbb

Time (s): cpu = 00:00:02 ; elapsed = 00:00:02 . Memory (MB): peak = 1075.164 ; gain = 0.000
Phase 3 Detail Placement | Checksum: 134190fbb

Time (s): cpu = 00:00:02 ; elapsed = 00:00:02 . Memory (MB): peak = 1075.164 ; gain = 0.000

Phase 4 Post Placement Optimization and Clean-Up

Phase 4.1 Post Commit Optimization
INFO: [Timing 38-35] Done setting XDC timing constraints.

Phase 4.1.1 updateClock Trees: PCOPT
Phase 4.1.1 updateClock Trees: PCOPT | Checksum: f7877386

Time (s): cpu = 00:00:02 ; elapsed = 00:00:02 . Memory (MB): peak = 1075.164 ; gain = 0.000

Phase 4.1.2 Post Placement Optimization
INFO: [Place 30-746] Post Placement Timing Summary WNS=6.955. For the most accurate timing information please run report_timing.
Phase 4.1.2 Post Placement Optimization | Checksum: 135895e3f

Time (s): cpu = 00:00:02 ; elapsed = 00:00:02 . Memory (MB): peak = 1075.164 ; gain = 0.000
Phase 4.1 Post Commit Optimization | Checksum: 135895e3f

Time (s): cpu = 00:00:02 ; elapsed = 00:00:02 . Memory (MB): peak = 1075.164 ; gain = 0.000

Phase 4.2 Sweep Clock Roots: Post-Placement
Phase 4.2 Sweep Clock Roots: Post-Placement | Checksum: 135895e3f

Time (s): cpu = 00:00:02 ; elapsed = 00:00:02 . Memory (MB): peak = 1075.164 ; gain = 0.000

Phase 4.3 Uram Pipeline Register Optimization
Phase 4.3 Uram Pipeline Register Optimization | Checksum: 135895e3f

Time (s): cpu = 00:00:02 ; elapsed = 00:00:02 . Memory (MB): peak = 1075.164 ; gain = 0.000

Phase 4.4 Post Placement Cleanup
Phase 4.4 Post Placement Cleanup | Checksum: 135895e3f

Time (s): cpu = 00:00:02 ; elapsed = 00:00:02 . Memory (MB): peak = 1075.164 ; gain = 0.000

Phase 4.5 Placer Reporting
Phase 4.5 Placer Reporting | Checksum: 135895e3f

Time (s): cpu = 00:00:02 ; elapsed = 00:00:02 . Memory (MB): peak = 1075.164 ; gain = 0.000

Phase 4.6 Final Placement Cleanup
Phase 4.6 Final Placement Cleanup | Checksum: 103f2c248

Time (s): cpu = 00:00:02 ; elapsed = 00:00:02 . Memory (MB): peak = 1075.164 ; gain = 0.000
Phase 4 Post Placement Optimization and Clean-Up | Checksum: 103f2c248

Time (s): cpu = 00:00:02 ; elapsed = 00:00:02 . Memory (MB): peak = 1075.164 ; gain = 0.000
Ending Placer Task | Checksum: 8c852e39

Time (s): cpu = 00:00:02 ; elapsed = 00:00:02 . Memory (MB): peak = 1075.164 ; gain = 0.000
INFO: [Common 17-83] Releasing license: Implementation
45 Infos, 0 Warnings, 0 Critical Warnings and 0 Errors encountered.
place_design completed successfully
Writing placer database...
Writing XDEF routing.
Writing XDEF routing logical nets.
Writing XDEF routing special nets.
Write XDEF Complete: Time (s): cpu = 00:00:01 ; elapsed = 00:00:00.090 . Memory (MB): peak = 1075.164 ; gain = 0.000
report_io: Time (s): cpu = 00:00:00 ; elapsed = 00:00:00.036 . Memory (MB): peak = 1075.164 ; gain = 0.000
report_utilization: Time (s): cpu = 00:00:00 ; elapsed = 00:00:00.023 . Memory (MB): peak = 1075.164 ; gain = 0.000
report_control_sets: Time (s): cpu = 00:00:00 ; elapsed = 00:00:00 . Memory (MB): peak = 1075.164 ; gain = 0.000
Command: route_design
Attempting to get a license for feature 'Implementation' and/or device 'xc7a35t'
INFO: [Common 17-349] Got license for feature 'Implementation' and/or device 'xc7a35t'
Running DRC as a precondition to command route_design
INFO: [DRC 23-27] Running DRC with 2 threads
INFO: [Vivado_Tcl 4-198] DRC finished with 0 Errors
INFO: [Vivado_Tcl 4-199] Please refer to the DRC report (report_drc) for more information.


Starting Routing Task
INFO: [Route 35-254] Multithreading enabled for route_design using a maximum of 2 CPUs
Checksum: PlaceDB: 2e1e00ef ConstDB: 0 ShapeSum: 5e672d4a RouteDB: 0

Phase 1 Build RT Design
Phase 1 Build RT Design | Checksum: f1185c87

Time (s): cpu = 00:00:23 ; elapsed = 00:00:21 . Memory (MB): peak = 1075.164 ; gain = 0.000

Phase 2 Router Initialization

Phase 2.1 Create Timer
Phase 2.1 Create Timer | Checksum: f1185c87

Time (s): cpu = 00:00:24 ; elapsed = 00:00:21 . Memory (MB): peak = 1075.164 ; gain = 0.000

Phase 2.2 Fix Topology Constraints
Phase 2.2 Fix Topology Constraints | Checksum: f1185c87

Time (s): cpu = 00:00:24 ; elapsed = 00:00:21 . Memory (MB): peak = 1075.164 ; gain = 0.000

Phase 2.3 Pre Route Cleanup
Phase 2.3 Pre Route Cleanup | Checksum: f1185c87

Time (s): cpu = 00:00:24 ; elapsed = 00:00:21 . Memory (MB): peak = 1075.164 ; gain = 0.000
 Number of Nodes with overlaps = 0

Phase 2.4 Update Timing
Phase 2.4 Update Timing | Checksum: 20cef4954

Time (s): cpu = 00:00:24 ; elapsed = 00:00:22 . Memory (MB): peak = 1075.164 ; gain = 0.000
INFO: [Route 35-416] Intermediate Timing Summary | WNS=6.715  | TNS=0.000  | WHS=0.005  | THS=0.000  |

Phase 2 Router Initialization | Checksum: 1e29029b5

Time (s): cpu = 00:00:24 ; elapsed = 00:00:22 . Memory (MB): peak = 1075.164 ; gain = 0.000

Phase 3 Initial Routing
Phase 3 Initial Routing | Checksum: 13cd7fb2d

Time (s): cpu = 00:00:25 ; elapsed = 00:00:22 . Memory (MB): peak = 1075.164 ; gain = 0.000

Phase 4 Rip-up And Reroute

Phase 4.1 Global Iteration 0
 Number of Nodes with overlaps = 7
 Number of Nodes with overlaps = 0

Phase 4.1.1 Update Timing
Phase 4.1.1 Update Timing | Checksum: 138dcf728

Time (s): cpu = 00:00:25 ; elapsed = 00:00:22 . Memory (MB): peak = 1075.164 ; gain = 0.000
INFO: [Route 35-416] Intermediate Timing Summary | WNS=6.713  | TNS=0.000  | WHS=N/A    | THS=N/A    |

Phase 4.1 Global Iteration 0 | Checksum: 138dcf728

Time (s): cpu = 00:00:25 ; elapsed = 00:00:22 . Memory (MB): peak = 1075.164 ; gain = 0.000
Phase 4 Rip-up And Reroute | Checksum: 138dcf728

Time (s): cpu = 00:00:25 ; elapsed = 00:00:22 . Memory (MB): peak = 1075.164 ; gain = 0.000

Phase 5 Delay and Skew Optimization

Phase 5.1 Delay CleanUp

Phase 5.1.1 Update Timing
Phase 5.1.1 Update Timing | Checksum: 7bb9b2d0

Time (s): cpu = 00:00:25 ; elapsed = 00:00:22 . Memory (MB): peak = 1075.164 ; gain = 0.000
INFO: [Route 35-416] Intermediate Timing Summary | WNS=6.807  | TNS=0.000  | WHS=N/A    | THS=N/A    |

Phase 5.1 Delay CleanUp | Checksum: 7bb9b2d0

Time (s): cpu = 00:00:25 ; elapsed = 00:00:22 . Memory (MB): peak = 1075.164 ; gain = 0.000

Phase 5.2 Clock Skew Optimization
Phase 5.2 Clock Skew Optimization | Checksum: 7bb9b2d0

Time (s): cpu = 00:00:25 ; elapsed = 00:00:22 . Memory (MB): peak = 1075.164 ; gain = 0.000
Phase 5 Delay and Skew Optimization | Checksum: 7bb9b2d0

Time (s): cpu = 00:00:25 ; elapsed = 00:00:22 . Memory (MB): peak = 1075.164 ; gain = 0.000

Phase 6 Post Hold Fix

Phase 6.1 Hold Fix Iter

Phase 6.1.1 Update Timing
Phase 6.1.1 Update Timing | Checksum: 514ca1fb

Time (s): cpu = 00:00:25 ; elapsed = 00:00:22 . Memory (MB): peak = 1075.164 ; gain = 0.000
INFO: [Route 35-416] Intermediate Timing Summary | WNS=6.807  | TNS=0.000  | WHS=0.306  | THS=0.000  |

Phase 6.1 Hold Fix Iter | Checksum: 514ca1fb

Time (s): cpu = 00:00:25 ; elapsed = 00:00:22 . Memory (MB): peak = 1075.164 ; gain = 0.000
Phase 6 Post Hold Fix | Checksum: 514ca1fb

Time (s): cpu = 00:00:25 ; elapsed = 00:00:22 . Memory (MB): peak = 1075.164 ; gain = 0.000

Phase 7 Route finalize

Router Utilization Summary
  Global Vertical Routing Utilization    = 0.107789 %
  Global Horizontal Routing Utilization  = 0.0961739 %
  Routable Net Status*
  *Does not include unroutable nets such as driverless and loadless.
  Run report_route_status for detailed report.
  Number of Failed Nets               = 0
  Number of Unrouted Nets             = 0
  Number of Partially Routed Nets     = 0
  Number of Node Overlaps             = 0

Phase 7 Route finalize | Checksum: 514ca1fb

Time (s): cpu = 00:00:25 ; elapsed = 00:00:22 . Memory (MB): peak = 1075.164 ; gain = 0.000

Phase 8 Verifying routed nets

 Verification completed successfully
Phase 8 Verifying routed nets | Checksum: 514ca1fb

Time (s): cpu = 00:00:25 ; elapsed = 00:00:22 . Memory (MB): peak = 1075.164 ; gain = 0.000

Phase 9 Depositing Routes
Phase 9 Depositing Routes | Checksum: 9105f4a5

Time (s): cpu = 00:00:25 ; elapsed = 00:00:22 . Memory (MB): peak = 1075.164 ; gain = 0.000

Phase 10 Post Router Timing
INFO: [Route 35-57] Estimated Timing Summary | WNS=6.807  | TNS=0.000  | WHS=0.306  | THS=0.000  |

INFO: [Route 35-327] The final timing numbers are based on the router estimated timing analysis. For a complete and accurate timing signoff, please run report_timing_summary.
Phase 10 Post Router Timing | Checksum: 9105f4a5

Time (s): cpu = 00:00:25 ; elapsed = 00:00:22 . Memory (MB): peak = 1075.164 ; gain = 0.000
INFO: [Route 35-16] Router Completed Successfully

Time (s): cpu = 00:00:25 ; elapsed = 00:00:22 . Memory (MB): peak = 1075.164 ; gain = 0.000

Routing Is Done.
INFO: [Common 17-83] Releasing license: Implementation
58 Infos, 0 Warnings, 0 Critical Warnings and 0 Errors encountered.
route_design completed successfully
route_design: Time (s): cpu = 00:00:25 ; elapsed = 00:00:22 . Memory (MB): peak = 1075.164 ; gain = 0.000
Writing placer database...
Writing XDEF routing.
Writing XDEF routing logical nets.
Writing XDEF routing special nets.
Write XDEF Complete: Time (s): cpu = 00:00:00 ; elapsed = 00:00:00.100 . Memory (MB): peak = 1075.164 ; gain = 0.000
INFO: [DRC 23-27] Running DRC with 2 threads
INFO: [Coretcl 2-168] The results of DRC are in file C:/Users/Thomas/Desktop/logicDesignLab/final project/display_test/display_test.runs/impl_1/top_drc_routed.rpt.
INFO: [Timing 38-91] UpdateTimingParams: Speed grade: -1, Delay Type: min_max.
INFO: [Timing 38-191] Multithreading enabled for timing update using a maximum of 2 CPUs
Running Vector-less Activity Propagation...

Finished Running Vector-less Activity Propagation
Attempting to get a license for feature 'Implementation' and/or device 'xc7a35t'
INFO: [Common 17-349] Got license for feature 'Implementation' and/or device 'xc7a35t'
Running DRC as a precondition to command write_bitstream
INFO: [DRC 23-27] Running DRC with 2 threads
INFO: [Vivado 12-3199] DRC finished with 0 Errors
INFO: [Vivado 12-3200] Please refer to the DRC report (report_drc) for more information.
INFO: [Designutils 20-2272] Running write_bitstream with 2 threads.
Loading data files...
Loading site data...
Loading route data...
Processing options...
Creating bitmap...
Creating bitstream...
Bitstream compression saved 14555200 bits.
Writing bitstream ./top.bit...
INFO: [Vivado 12-1842] Bitgen Completed Successfully.
INFO: [Project 1-120] WebTalk data collection is mandatory when using a WebPACK part without a full Vivado license. To see the specific WebTalk data collected for your design, open the usage_statistics_webtalk.html or usage_statistics_webtalk.xml file in the implementation directory.
存取被拒。
存取被拒。
INFO: [Common 17-83] Releasing license: Implementation
write_bitstream: Time (s): cpu = 00:00:12 ; elapsed = 00:00:11 . Memory (MB): peak = 1389.461 ; gain = 314.297
INFO: [Vivado_Tcl 4-395] Unable to parse hwdef file top.hwdef
INFO: [Common 17-206] Exiting Vivado at Thu May 25 01:34:27 2017...
